111111111;fantasía 2000;thomas b. o'conell;fantasia;prestado
222222222;harry potter y la cámara secreta;j.k.rowling;fantasia;disponible
333333333;de cabo a rabo: una historia homosexual;joan p. vicéns;picante;disponible
444444444;pepe el de los huevos repe;helen chufe;bricolaje;reservado
555555555;colega, ¿dónde está mi urbe? la atlántida y otras ciudades perdidas en la historia y el tiempo;andoni garrido hernández;historia;prestado
666666666;cocina para estudiantes: fácil, barata y deliciosa;dolores fuertes de barriga;cocina;prestado
777777777;kamasutra: como hacer aguas sin sufrir artritis;pelayo peláez;bricolaje;reservado
888888888;danza macabra;stephen king;terror;prestado
999999999;power station;gary cross;antologia;disponible
